{"$schema":"https://json-schema.org/draft/2020-12/schema","$id":"https://nxb.local/schemas/storage-etl-summary.schema.json","title":"NXB Storage ETL Event Summary","type":"object","required":["schema_version","summary_id","experiment_id","experiment_relative_path","machine_id","boot_id","trace_sha256","profile_sha256","event_export_sha256","adapter_sha256","source_format","trace_start_utc","trace_end_utc","target","quality","events","metrics","processes","summary","claims"],"additionalProperties":false,"properties":{"schema_version":{"const":1},"summary_id":{"$ref":"#/$defs/identifier"},"experiment_id":{"$ref":"#/$defs/identifier"},"experiment_relative_path":{"type":"string","pattern":"^experiments/[A-Za-z0-9._-]+$"},"machine_id":{"type":"string","minLength":1,"maxLength":512},"boot_id":{"$ref":"#/$defs/sha256"},"trace_sha256":{"$ref":"#/$defs/sha256"},"profile_sha256":{"$ref":"#/$defs/sha256"},"event_export_sha256":{"$ref":"#/$defs/sha256"},"adapter_sha256":{"$ref":"#/$defs/sha256"},"source_format":{"enum":["nxb_storage_event_export_v1","synthetic_fixture"]},"trace_start_utc":{"type":"string","format":"date-time"},"trace_end_utc":{"type":"string","format":"date-time"},"target":{"$ref":"#/$defs/target"},"quality":{"$ref":"#/$defs/quality"},"events":{"type":"object","required":["disk_read","disk_write","disk_flush","file_read","file_write","file_flush","file_create","file_close","file_delete","file_rename","split_io"],"additionalProperties":false,"properties":{"disk_read":{"$ref":"#/$defs/eventAggregate"},"disk_write":{"$ref":"#/$defs/eventAggregate"},"disk_flush":{"$ref":"#/$defs/eventAggregate"},"file_read":{"$ref":"#/$defs/eventAggregate"},"file_write":{"$ref":"#/$defs/eventAggregate"},"file_flush":{"$ref":"#/$defs/eventAggregate"},"file_create":{"$ref":"#/$defs/eventAggregate"},"file_close":{"$ref":"#/$defs/eventAggregate"},"file_delete":{"$ref":"#/$defs/eventAggregate"},"file_rename":{"$ref":"#/$defs/eventAggregate"},"split_io":{"$ref":"#/$defs/eventAggregate"}}},"metrics":{"type":"object","required":["queue_depth","queue_latency_us","service_time_us","throughput_bytes_per_second","iops"],"additionalProperties":false,"properties":{"queue_depth":{"$ref":"#/$defs/metricEvidence"},"queue_latency_us":{"$ref":"#/$defs/metricEvidence"},"service_time_us":{"$ref":"#/$defs/metricEvidence"},"throughput_bytes_per_second":{"$ref":"#/$defs/metricEvidence"},"iops":{"$ref":"#/$defs/metricEvidence"}}},"processes":{"type":"array","minItems":1,"maxItems":4096,"items":{"$ref":"#/$defs/processSummary"}},"summary":{"$ref":"#/$defs/summary"},"claims":{"$ref":"#/$defs/claims"}},"$defs":{"identifier":{"type":"string","minLength":1,"maxLength":128,"pattern":"^[A-Za-z0-9._:-]+$"},"sha256":{"type":"string","pattern":"^[0-9a-f]{64}$"},"source":{"type":"object","required":["collector","kind","provenance_sha256"],"additionalProperties":false,"properties":{"collector":{"const":"ConvertFrom-NxbStorageEventExport.ps1"},"kind":{"enum":["etw_summary","synthetic_fixture"]},"provenance_sha256":{"$ref":"#/$defs/sha256"}}},"eventAggregate":{"oneOf":[{"type":"object","required":["status","count","bytes","latency_us","unattributed_count","attribution","source","reason"],"additionalProperties":false,"properties":{"status":{"const":"measured"},"count":{"type":"integer","minimum":0},"bytes":{"type":["integer","null"],"minimum":0},"latency_us":{"oneOf":[{"$ref":"#/$defs/statistics"},{"type":"null"}]},"unattributed_count":{"type":"integer","minimum":0},"attribution":{"enum":["complete","partial","none"]},"source":{"$ref":"#/$defs/source"},"reason":{"type":"null"}}},{"type":"object","required":["status","count","bytes","latency_us","unattributed_count","attribution","source","reason"],"additionalProperties":false,"properties":{"status":{"enum":["unsupported","unavailable","failed","not_assessed"]},"count":{"type":"null"},"bytes":{"type":"null"},"latency_us":{"type":"null"},"unattributed_count":{"type":"null"},"attribution":{"const":"none"},"source":{"oneOf":[{"$ref":"#/$defs/source"},{"type":"null"}]},"reason":{"type":"string","minLength":1}}}]},"eventCount":{"oneOf":[{"type":"object","required":["status","count","bytes","latency_us","source","reason"],"additionalProperties":false,"properties":{"status":{"const":"measured"},"count":{"type":"integer","minimum":0},"bytes":{"type":["integer","null"],"minimum":0},"latency_us":{"oneOf":[{"$ref":"#/$defs/statistics"},{"type":"null"}]},"source":{"$ref":"#/$defs/source"},"reason":{"type":"null"}}},{"type":"object","required":["status","count","bytes","latency_us","source","reason"],"additionalProperties":false,"properties":{"status":{"enum":["unsupported","unavailable","failed","not_assessed"]},"count":{"type":"null"},"bytes":{"type":"null"},"latency_us":{"type":"null"},"source":{"oneOf":[{"$ref":"#/$defs/source"},{"type":"null"}]},"reason":{"type":"string","minLength":1}}}]},"statistics":{"type":"object","required":["samples","min","median","mean","max"],"additionalProperties":false,"properties":{"samples":{"type":"integer","minimum":1},"min":{"type":"number","minimum":0},"median":{"type":"number","minimum":0},"mean":{"type":"number","minimum":0},"max":{"type":"number","minimum":0}}},"metricEvidence":{"oneOf":[{"type":"object","required":["status","statistics","source","reason"],"additionalProperties":false,"properties":{"status":{"const":"measured"},"statistics":{"$ref":"#/$defs/statistics"},"source":{"$ref":"#/$defs/source"},"reason":{"type":"null"}}},{"type":"object","required":["status","statistics","source","reason"],"additionalProperties":false,"properties":{"status":{"enum":["unsupported","unavailable","failed","not_assessed"]},"statistics":{"type":"null"},"source":{"oneOf":[{"$ref":"#/$defs/source"},{"type":"null"}]},"reason":{"type":"string","minLength":1}}}]},"target":{"type":"object","required":["process_id","process_start_utc","image_sha256"],"additionalProperties":false,"properties":{"process_id":{"type":"integer","minimum":1},"process_start_utc":{"type":"string","format":"date-time"},"image_sha256":{"$ref":"#/$defs/sha256"}}},"quality":{"type":"object","required":["trace_loss","circular_overwrite","parser_completeness","unsupported_event_types","unsupported_metrics"],"additionalProperties":false,"properties":{"trace_loss":{"enum":["none","present","unknown"]},"circular_overwrite":{"enum":["none","possible","confirmed","unknown"]},"parser_completeness":{"enum":["complete","partial","failed"]},"unsupported_event_types":{"type":"array","uniqueItems":true,"items":{"enum":["disk_read","disk_write","disk_flush","file_read","file_write","file_flush","file_create","file_close","file_delete","file_rename","split_io"]}},"unsupported_metrics":{"type":"array","uniqueItems":true,"items":{"enum":["queue_depth","queue_latency_us","service_time_us","throughput_bytes_per_second","iops"]}}}},"processSummary":{"type":"object","required":["process_id","process_start_utc","image_sha256","identity_status","is_target","events"],"additionalProperties":false,"properties":{"process_id":{"type":"integer","minimum":1},"process_start_utc":{"type":["string","null"],"format":"date-time"},"image_sha256":{"oneOf":[{"$ref":"#/$defs/sha256"},{"type":"null"}]},"identity_status":{"enum":["complete","partial"]},"is_target":{"type":"boolean"},"events":{"type":"object","required":["disk_read","disk_write","disk_flush","file_read","file_write","file_flush","file_create","file_close","file_delete","file_rename","split_io"],"additionalProperties":false,"properties":{"disk_read":{"$ref":"#/$defs/eventCount"},"disk_write":{"$ref":"#/$defs/eventCount"},"disk_flush":{"$ref":"#/$defs/eventCount"},"file_read":{"$ref":"#/$defs/eventCount"},"file_write":{"$ref":"#/$defs/eventCount"},"file_flush":{"$ref":"#/$defs/eventCount"},"file_create":{"$ref":"#/$defs/eventCount"},"file_close":{"$ref":"#/$defs/eventCount"},"file_delete":{"$ref":"#/$defs/eventCount"},"file_rename":{"$ref":"#/$defs/eventCount"},"split_io":{"$ref":"#/$defs/eventCount"}}}}},"summary":{"type":"object","required":["process_count","measured_event_class_count","failed_event_class_count","measured_metric_count","failed_metric_count","evidence_completeness"],"additionalProperties":false,"properties":{"process_count":{"type":"integer","minimum":1,"maximum":4096},"measured_event_class_count":{"type":"integer","minimum":0,"maximum":11},"failed_event_class_count":{"type":"integer","minimum":0,"maximum":11},"measured_metric_count":{"type":"integer","minimum":0,"maximum":5},"failed_metric_count":{"type":"integer","minimum":0,"maximum":5},"evidence_completeness":{"enum":["complete","partial","unavailable","failed"]}}},"claims":{"type":"object","required":["queue_depth_semantics","queue_latency_semantics","service_time_semantics","throughput_representativeness","iops_representativeness","trace_completeness"],"additionalProperties":false,"properties":{"queue_depth_semantics":{"const":false},"queue_latency_semantics":{"const":false},"service_time_semantics":{"const":false},"throughput_representativeness":{"const":false},"iops_representativeness":{"const":false},"trace_completeness":{"const":"not_claimed"}}}}}