{"schema_version":1,"summary_id":"storage-fixture-001","experiment_id":"storage-fixture-001","experiment_relative_path":"experiments/storage-fixture-001","machine_id":"fixture-machine","boot_id":"1111111111111111111111111111111111111111111111111111111111111111","trace_sha256":"2222222222222222222222222222222222222222222222222222222222222222","profile_sha256":"3333333333333333333333333333333333333333333333333333333333333333","event_export_sha256":"4444444444444444444444444444444444444444444444444444444444444444","adapter_sha256":"5555555555555555555555555555555555555555555555555555555555555555","source_format":"synthetic_fixture","trace_start_utc":"2026-08-08T14:00:00Z","trace_end_utc":"2026-08-08T14:00:05Z","target":{"process_id":4242,"process_start_utc":"2026-08-08T13:59:59Z","image_sha256":"6666666666666666666666666666666666666666666666666666666666666666"},"quality":{"trace_loss":"unknown","circular_overwrite":"unknown","parser_completeness":"partial","unsupported_event_types":[],"unsupported_metrics":[]},"events":{"disk_read":{"status":"measured","count":2,"bytes":8192,"latency_us":null,"unattributed_count":0,"attribution":"complete","source":{"collector":"ConvertFrom-NxbStorageEventExport.ps1","kind":"synthetic_fixture","provenance_sha256":"7777777777777777777777777777777777777777777777777777777777777777"},"reason":null},"disk_write":{"status":"not_assessed","count":null,"bytes":null,"latency_us":null,"unattributed_count":null,"attribution":"none","source":null,"reason":"Synthetic fixture leaves this event class unassessed."},"disk_flush":{"status":"not_assessed","count":null,"bytes":null,"latency_us":null,"unattributed_count":null,"attribution":"none","source":null,"reason":"Synthetic fixture leaves this event class unassessed."},"file_read":{"status":"not_assessed","count":null,"bytes":null,"latency_us":null,"unattributed_count":null,"attribution":"none","source":null,"reason":"Synthetic fixture leaves this event class unassessed."},"file_write":{"status":"not_assessed","count":null,"bytes":null,"latency_us":null,"unattributed_count":null,"attribution":"none","source":null,"reason":"Synthetic fixture leaves this event class unassessed."},"file_flush":{"status":"not_assessed","count":null,"bytes":null,"latency_us":null,"unattributed_count":null,"attribution":"none","source":null,"reason":"Synthetic fixture leaves this event class unassessed."},"file_create":{"status":"not_assessed","count":null,"bytes":null,"latency_us":null,"unattributed_count":null,"attribution":"none","source":null,"reason":"Synthetic fixture leaves this event class unassessed."},"file_close":{"status":"not_assessed","count":null,"bytes":null,"latency_us":null,"unattributed_count":null,"attribution":"none","source":null,"reason":"Synthetic fixture leaves this event class unassessed."},"file_delete":{"status":"not_assessed","count":null,"bytes":null,"latency_us":null,"unattributed_count":null,"attribution":"none","source":null,"reason":"Synthetic fixture leaves this event class unassessed."},"file_rename":{"status":"not_assessed","count":null,"bytes":null,"latency_us":null,"unattributed_count":null,"attribution":"none","source":null,"reason":"Synthetic fixture leaves this event class unassessed."},"split_io":{"status":"not_assessed","count":null,"bytes":null,"latency_us":null,"unattributed_count":null,"attribution":"none","source":null,"reason":"Synthetic fixture leaves this event class unassessed."}},"metrics":{"queue_depth":{"status":"not_assessed","statistics":null,"source":null,"reason":"Real ETL field semantics are required before this metric is assessed."},"queue_latency_us":{"status":"not_assessed","statistics":null,"source":null,"reason":"Real ETL field semantics are required before this metric is assessed."},"service_time_us":{"status":"not_assessed","statistics":null,"source":null,"reason":"Real ETL field semantics are required before this metric is assessed."},"throughput_bytes_per_second":{"status":"not_assessed","statistics":null,"source":null,"reason":"Real ETL field semantics are required before this metric is assessed."},"iops":{"status":"not_assessed","statistics":null,"source":null,"reason":"Real ETL field semantics are required before this metric is assessed."}},"processes":[{"process_id":4242,"process_start_utc":"2026-08-08T13:59:59Z","image_sha256":"6666666666666666666666666666666666666666666666666666666666666666","identity_status":"complete","is_target":true,"events":{"disk_read":{"status":"measured","count":2,"bytes":8192,"latency_us":null,"source":{"collector":"ConvertFrom-NxbStorageEventExport.ps1","kind":"synthetic_fixture","provenance_sha256":"7777777777777777777777777777777777777777777777777777777777777777"},"reason":null},"disk_write":{"status":"not_assessed","count":null,"bytes":null,"latency_us":null,"source":null,"reason":"Synthetic fixture leaves this event class unassessed."},"disk_flush":{"status":"not_assessed","count":null,"bytes":null,"latency_us":null,"source":null,"reason":"Synthetic fixture leaves this event class unassessed."},"file_read":{"status":"not_assessed","count":null,"bytes":null,"latency_us":null,"source":null,"reason":"Synthetic fixture leaves this event class unassessed."},"file_write":{"status":"not_assessed","count":null,"bytes":null,"latency_us":null,"source":null,"reason":"Synthetic fixture leaves this event class unassessed."},"file_flush":{"status":"not_assessed","count":null,"bytes":null,"latency_us":null,"source":null,"reason":"Synthetic fixture leaves this event class unassessed."},"file_create":{"status":"not_assessed","count":null,"bytes":null,"latency_us":null,"source":null,"reason":"Synthetic fixture leaves this event class unassessed."},"file_close":{"status":"not_assessed","count":null,"bytes":null,"latency_us":null,"source":null,"reason":"Synthetic fixture leaves this event class unassessed."},"file_delete":{"status":"not_assessed","count":null,"bytes":null,"latency_us":null,"source":null,"reason":"Synthetic fixture leaves this event class unassessed."},"file_rename":{"status":"not_assessed","count":null,"bytes":null,"latency_us":null,"source":null,"reason":"Synthetic fixture leaves this event class unassessed."},"split_io":{"status":"not_assessed","count":null,"bytes":null,"latency_us":null,"source":null,"reason":"Synthetic fixture leaves this event class unassessed."}}}],"summary":{"process_count":1,"measured_event_class_count":1,"failed_event_class_count":0,"measured_metric_count":0,"failed_metric_count":0,"evidence_completeness":"partial"},"claims":{"queue_depth_semantics":false,"queue_latency_semantics":false,"service_time_semantics":false,"throughput_representativeness":false,"iops_representativeness":false,"trace_completeness":"not_claimed"}}